URL;fecha_envio;fecha_publicacion;pag_comentario;num_comentario;usuario;fecha;texto;votos;karma
https://www.meneame.net/story/juez-investiga-denuncia-salmantino-indica-portugal-irlanda-nos;1715350993;1715370604;1;86;Chaotic_and_Reckless_;1715382301;"#79 NO. La admisión a trámite de una denuncia, a todas luces una denuncia sin base, no es obligatoria. Es más, por el bien de la justicia, por el correcto funcionamiento de los juzgados, hay normas que impiden que se abuse del sistema judicial. Las mismas normas y directrices que impedían al facha juez admitir a trámite una denuncia basada en recortes de periódicos contra la mujer del presidente del gobierno... Y se pasó como este por los huevos morenos.  La justicia española es una puta vergüenza, el hazmereir a nivel internacional... Pero claro. Hay que investigar a todos excepto a los ""suyos"", para los casos del PP  ya está Garcia Castellón y compañia para archivar pese a que la fiscalía insista en que hay pruebas...";3;38
https://www.meneame.net/story/juez-investiga-denuncia-salmantino-indica-portugal-irlanda-nos;1715350993;1715370604;1;87;Jacusse;1715382933;#65 hay que hacerlos papilla (figuradamente). Humillar a ignorantes completos de un tema se lleva haciendo desde que el mundo es mundo. No pasa nada por no saber, pero al menos no saques pecho... Porque te lo hundirán.;1;20
https://www.meneame.net/story/juez-investiga-denuncia-salmantino-indica-portugal-irlanda-nos;1715350993;1715370604;1;88;Gurripander;1715393986;#1 Es lo que tiene la gente de letras, igual que los innumerables ikerjimenianos, que proliferan como hongos en todas partes... Se autoafirman y autoconvencen, entre ellos, en su completa ignorancia, en foros y redes sociales, creados a tal efecto, tipo ForoCoches...  Teniendo un caso reciente de un juez que ha admitido a trámite una denuncia falsa a la esposa de nuestro presidente del gobierno, realizada por un expresidiario recién salido de una condena por bulos, cualquier cosa puede ocurrir en el reino de Dios, si la justicia acaba perdiendo el norte de semejante modo...   Se hace cada vez más urgente la creación de un comité científico que asesore, en esa materia, a nuestra judicatura, que parece fallar, en lo más básico y elemental de ese tema...;0;0
https://www.meneame.net/story/juez-investiga-denuncia-salmantino-indica-portugal-irlanda-nos;1715350993;1715370604;1;89;perrico;1715401787;#1 Está gente que niega el cambio climático antropogénico pero luego te dice que una solo país (o 2 países en este caso) son capaces de hacerlo usando tan solo algún avión de vez en cuando.;1;23
https://www.meneame.net/story/juez-investiga-denuncia-salmantino-indica-portugal-irlanda-nos;1715350993;1715370604;1;90;Lord_Lurker;1715401957;#60 el multiplicador Keynesiano es un hecho. Como el dinero bancario. A lo mejor soy yo que no entiendo la posible  broma que pretendías hacer;0;0
https://www.meneame.net/story/juez-investiga-denuncia-salmantino-indica-portugal-irlanda-nos;1715350993;1715370604;1;91;Pilar_F.C.;1715402553;#50  Peor es el silencio, el que calla otorga. Ya no vale hoy en día intentar parar la difusión, por lo menos hay que introducir una duda en los indecisos.;0;0
https://www.meneame.net/story/juez-investiga-denuncia-salmantino-indica-portugal-irlanda-nos;1715350993;1715370604;1;92;gadolinio;1715405123;#91 lo entiendo, pero los que creen en esas cosas muchos lo hacen más por ir de anti sistemas que por creerlo realmente.   Hay mucho tarado e inútil mental entre nosotros;0;0
https://www.meneame.net/story/juez-investiga-denuncia-salmantino-indica-portugal-irlanda-nos;1715350993;1715370604;1;93;imagosg;1715406080;#11 El 99% de éstos analfabetos suele ser de Pp- Vox . Bulos, negacionismos y otros disparates ..  es la manera que tienen éstos cuñados de sentirse diferentes , de pertenecer a un club especial;0;0
https://www.meneame.net/story/juez-investiga-denuncia-salmantino-indica-portugal-irlanda-nos;1715350993;1715370604;1;94;sliana;1715411414;"#1 quieres decir ""camaras de vigilancia en celo"", supongo.";0;0
https://www.meneame.net/story/juez-investiga-denuncia-salmantino-indica-portugal-irlanda-nos;1715350993;1715370604;1;95;Pacoinfeliz;1715411827;#90 Un hecho que ocurre en novelas y cuentos, sí. Un hecho de ficción.;0;0
https://www.meneame.net/story/juez-investiga-denuncia-salmantino-indica-portugal-irlanda-nos;1715350993;1715370604;1;96;Mark_;1715413828;#89 eso me parece una fantasía porque es soplar y sorber en la misma frase, solo que cuando se lo dices te responden que ellos soplan con la boca y sorben con el culo porque han investigado (en un blog con los márgenes enormes) y si quieres dejar de ser un borrego investiga tú, porque respuestas nunca te dan.;0;0
https://www.meneame.net/story/juez-investiga-denuncia-salmantino-indica-portugal-irlanda-nos;1715350993;1715370604;1;97;taranganas;1715418239;Hubo alguien yanky que pretendio por ley que pi fuera 3,25 , la tierra es plana y la historia esta llena de iluminaos;0;0
https://www.meneame.net/story/juez-investiga-denuncia-salmantino-indica-portugal-irlanda-nos;1715350993;1715370604;1;98;Paltus;1715418962;#1 Soy científico y aunque lo vea descabellado, la duda y la comprobación es la base de la ciencia.  A veces hasta lo más inverosímil te puede sorprender. Empiezan a haber evidencias de intentos de modificar el clima en varios puntos del planeta.  Lo más lógico desde un punto de vista científico es hacer una comprobación y si se demuestra que es falso se cierra el caso. Pero es tan dogmático creer en los chemtrails como sin ninguna comprobación dar por supuesto que algún ente intenta cosechar lluvia.;1;21
https://www.meneame.net/story/juez-investiga-denuncia-salmantino-indica-portugal-irlanda-nos;1715350993;1715370604;1;99;the_unico;1715420045;#11 pero si menéame ha sido de los sitios, grupos, todo menos magufos he visto desde su fundación!;0;0
https://www.meneame.net/story/juez-investiga-denuncia-salmantino-indica-portugal-irlanda-nos;1715350993;1715370604;1;100;Pilar_F.C.;1715420832;#25  Hasta el autor lo negó... Pues esperando ese artículo.;0;0
https://www.meneame.net/story/juez-investiga-denuncia-salmantino-indica-portugal-irlanda-nos;1715350993;1715370604;2;101;pcmaster;1715423208;#86 Pero antes de decidir si la admiten a trámite tendrán que investigar si tiene algún fundamento.;0;0
https://www.meneame.net/story/juez-investiga-denuncia-salmantino-indica-portugal-irlanda-nos;1715350993;1715370604;2;102;NinjaBoig;1715431152;#85 Pues no, pero no me mola emasiado, la verdad. Todo el mundo sabe que ya lo hacen con insectos!;0;0
https://www.meneame.net/story/juez-investiga-denuncia-salmantino-indica-portugal-irlanda-nos;1715350993;1715370604;2;103;victorjba;1715448819;#10 Aun así. Para que nos roben la lluvia hay que partir de la base de que la lluvia es nuestra, lo cual es muuuuucho suponer.;0;0
https://www.meneame.net/story/turbas-colonos-israelies-bajo-supervision-gobierno-israeli-estan;1715350357;1715368504;1;1;Verdaderofalso;1715350374;Colonos o invasores?;10;108
https://www.meneame.net/story/turbas-colonos-israelies-bajo-supervision-gobierno-israeli-estan;1715350357;1715368504;1;2;lixus;1715350489;Asco infinito de los miserables sionistas.;6;57
https://www.meneame.net/story/turbas-colonos-israelies-bajo-supervision-gobierno-israeli-estan;1715350357;1715368504;1;3;Homointerreticulatus;1715350852;Estas barbaridades solo las puedes hacer si estás cegado por una religión.;4;42
https://www.meneame.net/story/turbas-colonos-israelies-bajo-supervision-gobierno-israeli-estan;1715350357;1715368504;1;4;jobar;1715350960;Ojalá puedan identificarles para que cuando salgan del país de vacaciones o lo que sea les puedan procesar por participar estos delitos de lesa humanidad, porque inmunidad diplomática estos no tienen.;16;153
https://www.meneame.net/story/turbas-colonos-israelies-bajo-supervision-gobierno-israeli-estan;1715350357;1715368504;1;5;aupaatu;1715351102;La bandada de cobardes colonos ,respadaos por un ejército asesino, jugando a manifestarse, para contarles a sus cachorros sus azañas bélicas.;6;67
https://www.meneame.net/story/turbas-colonos-israelies-bajo-supervision-gobierno-israeli-estan;1715350357;1715368504;1;6;nestaris;1715352816;El sionismo está plantando unas semillas que le va a dar unos frutos muy amargos. Las cosas, normalmente, no paren cuando preñan.;5;44
https://www.meneame.net/story/turbas-colonos-israelies-bajo-supervision-gobierno-israeli-estan;1715350357;1715368504;1;7;ErJakerNROL35;1715353890;#4 esos no van nunca de vacaciones;3;30
https://www.meneame.net/story/turbas-colonos-israelies-bajo-supervision-gobierno-israeli-estan;1715350357;1715368504;1;8;oraculus_reloaded;1715359634;¿Les gustaría que se lo hicieran a ellos?.;0;0
https://www.meneame.net/story/turbas-colonos-israelies-bajo-supervision-gobierno-israeli-estan;1715350357;1715368504;1;9;BiRDo;1715362520;A alguien más no le va el vídeo?;0;0
https://www.meneame.net/story/turbas-colonos-israelies-bajo-supervision-gobierno-israeli-estan;1715350357;1715368504;1;10;sinson;1715364762;#9 Con Firefox. Clic al video y abrir en una ventana nueva;0;0
https://www.meneame.net/story/turbas-colonos-israelies-bajo-supervision-gobierno-israeli-estan;1715350357;1715368504;1;11;sofazen;1715368728;#1 Asquerosos invasores llamado colonos que llevan décadas robando y apropiándose de tierras que no les pertenecen.;3;30
https://www.meneame.net/story/turbas-colonos-israelies-bajo-supervision-gobierno-israeli-estan;1715350357;1715368504;1;12;Aqui_en_la_Pelu;1715368834;Turbas de nazis israelíes, bajo la supervisión del gobierno nazi-israelí, están bloqueando las carreteras para impedir la llegada de ayuda humanitaria a Gaza.;2;19
https://www.meneame.net/story/turbas-colonos-israelies-bajo-supervision-gobierno-israeli-estan;1715350357;1715368504;1;13;malajaita;1715369027;#3 O por el nacionalismo.;1;18
https://www.meneame.net/story/turbas-colonos-israelies-bajo-supervision-gobierno-israeli-estan;1715350357;1715368504;1;14;malajaita;1715369169;#5 Los colonos y el ejército allí son lo mismo, como en Suiza, con la diferencia que en la confederación helvética no son colonos solo suizos.;0;0
https://www.meneame.net/story/turbas-colonos-israelies-bajo-supervision-gobierno-israeli-estan;1715350357;1715368504;1;15;vviccio;1715369316;Llamaron a lo peor de cada casa para que fueran ahí. Gente con la cabeza metida en una burbuja de odio y memes de mierda que no representan a la sociedad de Israel.;1;17
https://www.meneame.net/story/turbas-colonos-israelies-bajo-supervision-gobierno-israeli-estan;1715350357;1715368504;1;16;EmuAGR;1715369583;#1 Colonizadores, que es un término más sincero.;0;0
https://www.meneame.net/story/turbas-colonos-israelies-bajo-supervision-gobierno-israeli-estan;1715350357;1715368504;1;17;troll_hdlgp;1715369689;#13 No son excluyentes, de hecho suelen ir de la mano, nuestro país es un buen ejemplo de eso.;0;0
https://www.meneame.net/story/turbas-colonos-israelies-bajo-supervision-gobierno-israeli-estan;1715350357;1715368504;1;18;Toponotomalasuerte;1715369966;#1 hijos de puta, más bien.;2;21
https://www.meneame.net/story/turbas-colonos-israelies-bajo-supervision-gobierno-israeli-estan;1715350357;1715368504;1;19;Ainur;1715369974;Cómo de mal hay que estar para que apoyes activamente la aniquilación de gente normal joder.;0;0
https://www.meneame.net/story/turbas-colonos-israelies-bajo-supervision-gobierno-israeli-estan;1715350357;1715368504;1;20;troll_hdlgp;1715369995;(edit: borrado);0;0
https://www.meneame.net/story/turbas-colonos-israelies-bajo-supervision-gobierno-israeli-estan;1715350357;1715368504;1;21;troll_hdlgp;1715370044;#9 Esto es lo mas directo que puedo sacar video.twimg.com/ext_tw_video/1788576890334183424/pu/vid/avc1/320x570/L;0;0
https://www.meneame.net/story/turbas-colonos-israelies-bajo-supervision-gobierno-israeli-estan;1715350357;1715368504;1;22;sieteymedio;1715370051;#3 No, no es religión. Es que van a ganar un montón de terreno totalmente gratis y no ven la hora de acabar de asesinar a los actuales propietarios.  Tú imaginate que vas a un sitio a robar tierras apoyado por el ejército. Vale, estás rodeado de militares amigos, pero siempre tienes el miedo de que te puedan volver a reclamar de alguna manera lo que has robado, la amenaza constante de que te molesten.  Entonces piensa el contexto actual: están a punto de acabar con la amenaza y sentirse totalmente seguros sin necesidad siquiera del ejército.   Están exultantes, les importa una puta mierda lo que piensen de ellos el resto del mundo.;2;29
https://www.meneame.net/story/turbas-colonos-israelies-bajo-supervision-gobierno-israeli-estan;1715350357;1715368504;1;23;malajaita;1715370299;#17 Claro, pero también pueden ir por libre, de hecho es un problema de ceguera, pero más dificil de diagnosticar en lo nacional. En lo religioso la ceguera se llama fe. Con los asuntos de país ¿que? paisajismo seguro que no es.;0;0
https://www.meneame.net/story/turbas-colonos-israelies-bajo-supervision-gobierno-israeli-estan;1715350357;1715368504;1;24;Stal4g17;1715370536;#19 no creo que estos criminales consideren a los palestinos como seres humanos;0;0
https://www.meneame.net/story/turbas-colonos-israelies-bajo-supervision-gobierno-israeli-estan;1715350357;1715368504;1;25;Bapho;1715370910;En serio que esta gente no entiendo como han llegado a tener esta falta total de humanidad.;1;18
https://www.meneame.net/story/turbas-colonos-israelies-bajo-supervision-gobierno-israeli-estan;1715350357;1715368504;1;26;zeekren;1715371335;#15 me temo que su sentir gana elecciones, igual sí que representan a su mierda de sociedad enferma.;0;0
https://www.meneame.net/story/turbas-colonos-israelies-bajo-supervision-gobierno-israeli-estan;1715350357;1715368504;1;27;Eulalia.Murcia.;1715372344;#2 Me adhiero a este comentario. Que tenga yo misma que impedir meterme en este lugar u otro donde se hable de actualidad por no enterarme de este tipo de cosas antes de intentar dormir... joder ya han echo bueno a Hitler estos locos desalmados que no deberían de existir. Y sé que este comentario es muy fuerte, pero me sale de todas las entrañas.;2;16
https://www.meneame.net/story/turbas-colonos-israelies-bajo-supervision-gobierno-israeli-estan;1715350357;1715368504;1;28;Eulalia.Murcia.;1715372575;#3 Solo si eres un puto loco sanguinario al que su dios le dijo que matase a todos TODOS los que no fuesen judíos de sangre, porque eran el pueblo elegido y solo creando el caos volvería su Mesías. Por eso los han echado de todos lados en todos los momentos de la Historia. Son una plaga de cucarachas a extinguir con gases.;1;13
https://www.meneame.net/story/turbas-colonos-israelies-bajo-supervision-gobierno-israeli-estan;1715350357;1715368504;1;29;unlugar;1715376638;www.unav.edu/opinion/-/contents/09/07/2019/el-auge-del-victimismo-y-la;0;0
https://www.meneame.net/story/turbas-colonos-israelies-bajo-supervision-gobierno-israeli-estan;1715350357;1715368504;1;30;mmlv;1715379390;Sturmabteilung;0;0
https://www.meneame.net/story/turbas-colonos-israelies-bajo-supervision-gobierno-israeli-estan;1715350357;1715368504;1;31;Jesulisto;1715381839;Me cuesta menos entender a los que hacen esas barbaridades que, entiendo, que tienen el coco comido desde pequeños que a los países que lo financian, lo consienten o miran para otro lado.;1;15
https://www.meneame.net/story/turbas-colonos-israelies-bajo-supervision-gobierno-israeli-estan;1715350357;1715368504;1;32;Mimaus;1715388172;#31 son aves de rapiña, gentuza vaga y avariciosa que vive del expolio y el asesinato.;2;23
https://www.meneame.net/story/turbas-colonos-israelies-bajo-supervision-gobierno-israeli-estan;1715350357;1715368504;1;33;Ergo_2k1;1715389281;#25 ahora sabemos por qué no los han querido en ninguna parte en ninguna época de la Historia;0;0
https://www.meneame.net/story/once-anos-llevo-cubriendo-eurovision-nunca-habia-sentido-tan;1715359735;1715367304;1;1;cenutrios_unidos;1715359846;Ante fascistas, ni un paso atrás.   No dejemos que ganen los hijos de puta sin moral.;65;517
https://www.meneame.net/story/once-anos-llevo-cubriendo-eurovision-nunca-habia-sentido-tan;1715359735;1715367304;1;2;oraculus_reloaded;1715360041;O sea que los periodistas son pro-genocidas también.;14;122
https://www.meneame.net/story/once-anos-llevo-cubriendo-eurovision-nunca-habia-sentido-tan;1715359735;1715367304;1;3;DenisseJoel;1715360168;Es un estado fascista. Invitarles a Eurovisión es como invitar a la Alemania nazi durante el holocausto.;28;180
https://www.meneame.net/story/once-anos-llevo-cubriendo-eurovision-nunca-habia-sentido-tan;1715359735;1715367304;1;4;Ratoncolorao;1715360315;Añadamos que hoy la organización ha ido quitando acreditaciones a todos los que difundieron los abucheos... Y recuerden, el patrocinador de este año es la empresa israelí Moroccanoil que estará apretando las tuercas. Empiezo a sospechar que hay un plan detrás de todo esto y pretenden que gane Israel , pero eso sería un golpe de muerte para el festival, a ver quién coño va a cantar a Tel Aviv al año que viene con aviones sobrevolando los cielos.;38;312
https://www.meneame.net/story/once-anos-llevo-cubriendo-eurovision-nunca-habia-sentido-tan;1715359735;1715367304;1;5;jobar;1715360329;#2 Aquí dudo seriamente que su oficio sea el de periodistas.;19;170
https://www.meneame.net/story/once-anos-llevo-cubriendo-eurovision-nunca-habia-sentido-tan;1715359735;1715367304;1;6;txutxo;1715360357;Esta mierda de Festival, porque es una puta mierda amañada. a la altura de los genocidas.;14;114
https://www.meneame.net/story/once-anos-llevo-cubriendo-eurovision-nunca-habia-sentido-tan;1715359735;1715367304;1;7;IsraelEstadoGenocida;1715360377;#5 son defensores de la línea argumental de la politica oficial del partido;6;65
https://www.meneame.net/story/once-anos-llevo-cubriendo-eurovision-nunca-habia-sentido-tan;1715359735;1715367304;1;8;Ratoncolorao;1715360500;#6 Para ser una mierda vaya dos semanas que llevamos con el temita, eh?;2;42
https://www.meneame.net/story/once-anos-llevo-cubriendo-eurovision-nunca-habia-sentido-tan;1715359735;1715367304;1;9;Lekuar;1715360608;Pues los intimidas tú a ellos, me da en la espina que se achantarian rápido.;0;0
https://www.meneame.net/story/once-anos-llevo-cubriendo-eurovision-nunca-habia-sentido-tan;1715359735;1715367304;1;10;txutxo;1715360773;"Desde octubre de 2023 llevamos con el ""temita"" .";0;0
https://www.meneame.net/story/once-anos-llevo-cubriendo-eurovision-nunca-habia-sentido-tan;1715359735;1715367304;1;11;Khadgar;1715360791;#4 Si fueron los pilotos a Arabia Saudí a correr con lo que había allí...;0;0
https://www.meneame.net/story/once-anos-llevo-cubriendo-eurovision-nunca-habia-sentido-tan;1715359735;1715367304;1;12;angeloso;1715360882;#4 Ganó Ucrania hace 2 y se celebró al año siguiente en Reino Unido. Ya se buscarían la manera de hacerlo en un sitio tranquilo.;11;119
https://www.meneame.net/story/once-anos-llevo-cubriendo-eurovision-nunca-habia-sentido-tan;1715359735;1715367304;1;13;Ratoncolorao;1715361106;#12 ¿Crees que con lo crecidos que están en israel no se empeñarían en celebrarlo ellos? Porque capaces son.;2;40
https://www.meneame.net/story/once-anos-llevo-cubriendo-eurovision-nunca-habia-sentido-tan;1715359735;1715367304;1;14;angeloso;1715361314;#13 Ellos querrían, pero el temor a un boikot y tener un festival a medio gas haría que la organización se plantease el cambio. Al final, este festival es propaganda y dinero.;4;48
https://www.meneame.net/story/once-anos-llevo-cubriendo-eurovision-nunca-habia-sentido-tan;1715359735;1715367304;1;15;suzy;1715361531;#4 pues con toda la publicidad que se le está haciendo en contra lo más probable es que se genere el efecto streisand;1;21
https://www.meneame.net/story/once-anos-llevo-cubriendo-eurovision-nunca-habia-sentido-tan;1715359735;1715367304;1;16;frankiegth;1715361715;#6 #8. El festival estaba bien, lo que es intolerable es el uso geopolítico, el blanqueamiento y el doble rasero que decididamente se gastan los organizadores de Eurovisión de este año. Si ganasen los genocidas este año sería el acabose, pero no solo para Eurovisión... lo del 15M español podría quedar en anécdota con lo que podría avecinarse ante la creciente indignación internacional ciudadana. No todo lo compra el dinero ni todo se puede tapar con dinero.;3;43
https://www.meneame.net/story/once-anos-llevo-cubriendo-eurovision-nunca-habia-sentido-tan;1715359735;1715367304;1;17;plutanasio;1715361994;"#6 pues si, es una puta mierda y la gente no hace más que llorar y dar la turra. si de verdad quieren hacer daño a ese friki festival lo que tienen que hacer es no verlo y no darle publicidad. boikot total a esa mierda y que se hundan los ingresos por publicidad. cuanto más se hable de él más expectación se va a crear y más gente, que antes no lo iba a ver, lo verá por el morbo de ver que pasa.  es que la gente no aprende joder. les estáis haciendo la campaña de publicidad. ""que hablen de mi, aunque sea mal""";2;21
https://www.meneame.net/story/once-anos-llevo-cubriendo-eurovision-nunca-habia-sentido-tan;1715359735;1715367304;1;18;Urasandi;1715363089;Pol Pot, Ngema, Videla,...;0;0
https://www.meneame.net/story/once-anos-llevo-cubriendo-eurovision-nunca-habia-sentido-tan;1715359735;1715367304;1;19;skout2;1715364389;"Lo repito aunque me suspendan la cuenta; Israel merece desaparecer del mapa, ojala algún día mis ojos lo vean.";7;37
https://www.meneame.net/story/once-anos-llevo-cubriendo-eurovision-nunca-habia-sentido-tan;1715359735;1715367304;1;20;Kosimo;1715367505;Ya lo dije hace tiempo…. Resulta que los putos nazis tenían razón…  (Ojo! Que soy antifascista!);5;-30
https://www.meneame.net/story/once-anos-llevo-cubriendo-eurovision-nunca-habia-sentido-tan;1715359735;1715367304;1;21;vildor;1715367559;"Sí sí, ""periodistas""...";1;9
https://www.meneame.net/story/once-anos-llevo-cubriendo-eurovision-nunca-habia-sentido-tan;1715359735;1715367304;1;22;Mustela;1715367663;Aquí diré que en TVE no he visto una sola protesta de nada, ni en pleno directo de Eurovisión ni esta mañana que hacían una especie de programa referente a este. Nada, como si Israel fuese totalmente ajeno a conflictos de cualquier tipo.;4;50
https://www.meneame.net/story/once-anos-llevo-cubriendo-eurovision-nunca-habia-sentido-tan;1715359735;1715367304;1;23;DenisseJoel;1715367803;#17 ¿A ti te gusta que hablen mal de ti?;0;0
https://www.meneame.net/story/once-anos-llevo-cubriendo-eurovision-nunca-habia-sentido-tan;1715359735;1715367304;1;24;obmultimedia;1715367819;#6 Tan amañada que ganó hace dos años España pero por politiquero le dieron el primer puesto a Ucrania;0;0
https://www.meneame.net/story/once-anos-llevo-cubriendo-eurovision-nunca-habia-sentido-tan;1715359735;1715367304;1;25;mecha;1715368147;#3 como celebrar una olimpiadas en la Alemania nazi quieres decir?;11;117
https://www.meneame.net/story/once-anos-llevo-cubriendo-eurovision-nunca-habia-sentido-tan;1715359735;1715367304;1;26;johel;1715368247;"#5 Deberian crear una carrera que fuese ""profesional del entretenimiento*"", aunque no nos guste es lo que son.  *Luego pueden añadir un master opcional en la basura, miserias y carnaza.";2;27
https://www.meneame.net/story/once-anos-llevo-cubriendo-eurovision-nunca-habia-sentido-tan;1715359735;1715367304;1;27;malajaita;1715368279;#8 Pués lo que nos vamos a reir hasta noviembre por la próxima edición de Eurovisión Junior con sede en Madrid.;1;20
https://www.meneame.net/story/once-anos-llevo-cubriendo-eurovision-nunca-habia-sentido-tan;1715359735;1715367304;1;28;Jeu;1715368308;#20 Pues para ser antifascista estás diciendo una burrada muy gorda.  ¿En qué tenían razón los nazis?;3;39
https://www.meneame.net/story/once-anos-llevo-cubriendo-eurovision-nunca-habia-sentido-tan;1715359735;1715367304;1;29;Jeu;1715368369;#22 España está muerta desde hace tiempo.;0;0
https://www.meneame.net/story/once-anos-llevo-cubriendo-eurovision-nunca-habia-sentido-tan;1715359735;1715367304;1;30;frg;1715368385;#25 No se por qué, pero me suena.;1;23
https://www.meneame.net/story/once-anos-llevo-cubriendo-eurovision-nunca-habia-sentido-tan;1715359735;1715367304;1;31;josejon;1715368500;"#3 Lo cierto es que la Alemania nazi organizó unos juegos olímpicos (1936) bajo la presidencia de Hitler. Desgraciadamente, antecedentes sobre el consentimiento a lo indigno los hay; las lágrimas y las películas muy tristes vienen años después.";2;26
https://www.meneame.net/story/once-anos-llevo-cubriendo-eurovision-nunca-habia-sentido-tan;1715359735;1715367304;1;32;frg;1715368526;"#22 Ni lo verás. Seguro que emiten en ""falso directo"" por si las moscas.";1;18
https://www.meneame.net/story/once-anos-llevo-cubriendo-eurovision-nunca-habia-sentido-tan;1715359735;1715367304;1;33;Jesulisto;1715368534;Los matones se merecen su mismo tratamiento, o los  paras o se crecen.   Había un dicho sobre si diez personas, no recuerdo el número, cenaban con un nazi, en realidad había once nazis en la cena.   Pues lo mismo, solo merecen el rechazo y la exclusión por parte de las personas con algo de humanidad.;1;19
https://www.meneame.net/story/once-anos-llevo-cubriendo-eurovision-nunca-habia-sentido-tan;1715359735;1715367304;1;34;Jointhouse_Blues;1715369043;#5 Perros del mossad velando por la seguridad y dirigiendo el relato.;1;19
https://www.meneame.net/story/once-anos-llevo-cubriendo-eurovision-nunca-habia-sentido-tan;1715359735;1715367304;1;35;jobar;1715369141;#26 Digo los de Israel.;0;0
https://www.meneame.net/story/once-anos-llevo-cubriendo-eurovision-nunca-habia-sentido-tan;1715359735;1715367304;1;36;Ranma12;1715369794;Esos periodistas israelíes se pasan por el forro el código deontológico. Irónicamente, el que se está quejando, también.;0;0
