URL;fecha_envio;fecha_publicacion;pag_comentario;num_comentario;usuario;fecha;texto;votos;karma
https://www.meneame.net/story/arresten-lideres-israel-crimenes-guerra;1715371648;1715379303;1;1;ingenierodepalillos;1715371791;O que les den de hostias hasta hartarse, son tan despreciables que han conseguido que me rebaje a su nivel, eso no lo consigue cualquiera.;8;77
https://www.meneame.net/story/arresten-lideres-israel-crimenes-guerra;1715371648;1715379303;1;2;Top_Banana;1715372035;#1 Sea cual sea la opción, seguro que preferirán estar muertos.   Y a todo cerdo le llega su san martin.;3;35
https://www.meneame.net/story/arresten-lideres-israel-crimenes-guerra;1715371648;1715379303;1;3;Top_Banana;1715372235;Un saludo Mysto, ¡hermoso!;4;51
https://www.meneame.net/story/arresten-lideres-israel-crimenes-guerra;1715371648;1715379303;1;4;CharlesBrowson;1715372556;Es tal es desproposito y la barbarie que no cabe otra cosa que la disolucion de ese infame estado y que haya una segunda diaspora, porque ya no es la clase dirigente que deberian acabar bailando el hava nagila hava con los pies en el aire, sino de toda la infame sociedad israeli, obligar a escribir en su pozoñosa torah un capitulo de esta barbarie para que nuca se olvide.;6;52
https://www.meneame.net/story/arresten-lideres-israel-crimenes-guerra;1715371648;1715379303;1;5;BigMom;1715372955;#1 Es el problema, uno no quiere rebajarse. Pero llega un punto en el que piensas que acabar con ellos al final es la solución. Y para mí se queda en pensarlo, pero otros no lo harán y pasará lo peor.;3;33
https://www.meneame.net/story/arresten-lideres-israel-crimenes-guerra;1715371648;1715379303;1;6;Top_Banana;1715372963;"#4 Bueno, el que escribe es un periodista Israelí que lleva años informando de la ocupación. Son parte de esa sociedad aunque esten ""silenciados"" y están en contra del genocidio, hay que darles voz.";9;88
https://www.meneame.net/story/arresten-lideres-israel-crimenes-guerra;1715371648;1715379303;1;7;ur_quan_master;1715374962;#1 una soga y a bailar. Como en los juicios de Núremberg;6;60
https://www.meneame.net/story/arresten-lideres-israel-crimenes-guerra;1715371648;1715379303;1;8;cocolisto;1715375180;No se porqué cuando oigo hablar de los sionistas me viene la imagen de Mussolini colgado bocabajo.;4;64
https://www.meneame.net/story/arresten-lideres-israel-crimenes-guerra;1715371648;1715379303;1;9;estemenda;1715375640;La clave de bóveda del sionismo es la aquiescencia usana, al final puede suceder como en Vietnam, que el catalizador de la retirada sean las manifestaciones en los colleges estadounidenses, aunque la situación ya venga siendo incómoda hasta para estos aprendices de pueblo elegido.;3;24
https://www.meneame.net/story/arresten-lideres-israel-crimenes-guerra;1715371648;1715379303;1;10;BuckMulligan;1715379934;Israeli decente? Todo Israeli no juzgado debe pasar por un proceso de desnacificacion. Sin excepciónes;4;42
https://www.meneame.net/story/arresten-lideres-israel-crimenes-guerra;1715371648;1715379303;1;11;Suleiman;1715380150;Tienen mamado el discurso desde que nacen. Jamás,ni por asomo dudarán que no están haciendo lo correcto.Más bien al contrario, que son unos mártires y que han de luchar a viento y marea contra todo el mal que les acosa... Solo hace falta ver cómo actúan y piensan la mayoria de civiles... Y más de uno cree que son muy blandos...;4;27
https://www.meneame.net/story/arresten-lideres-israel-crimenes-guerra;1715371648;1715379303;1;12;xinxaxoxos;1715380310;#1 ¿Pero quien se debe hartar? ¿El que ahostia, o el que recibe?;1;20
https://www.meneame.net/story/arresten-lideres-israel-crimenes-guerra;1715371648;1715379303;1;13;Janssen;1715380580;"?Quién va a tener los cojones para hacerlo?... No veo a nadie. ""Papá""(EEUU) y la UE no lo harán.";0;0
https://www.meneame.net/story/arresten-lideres-israel-crimenes-guerra;1715371648;1715379303;1;14;sofazen;1715381314;Israel lleva decenas de años cometiendo abusos contra los palestinos. Aparte de los colonos robando propiedades, todos los chavales y chavalas que han hecho la mili, creo que de 2 años, han abusado de alguna forma de personas desarmadas e indefensas. Está todo tan podrido que es difícil poder separar el trigo limpio. Y más si lo han de hacer ellos.;5;53
https://www.meneame.net/story/arresten-lideres-israel-crimenes-guerra;1715371648;1715379303;1;15;zeekren;1715381483;#5 al final es la solución. Hay demasiados individuos que consumen y contaminan en un planeta al borde del colapso.  Salvemos a la personas, la humanidad es una gran cosa, y no se merece irse a la mierda de la mano de tanto hijoputa.  Reduzcamos las emisiones de una puta vez, empezando por todos los votantes del actual gobierno israelí, luego ya veremos quién viene después, pero lo de estos es apremiante.;2;27
https://www.meneame.net/story/arresten-lideres-israel-crimenes-guerra;1715371648;1715379303;1;16;zeekren;1715381689;#14 chicas 2 años, chicos 3.;3;37
https://www.meneame.net/story/arresten-lideres-israel-crimenes-guerra;1715371648;1715379303;1;17;Amonamantangorri;1715382076;#6 Él mismo Gideon Levy ha reconocido que no le hacen caso ni sus propios hijos.;1;27
https://www.meneame.net/story/arresten-lideres-israel-crimenes-guerra;1715371648;1715379303;1;18;manc0ntr0;1715382120;#16 tela, 2 o 3 años de mili. No debe ser broma;1;15
https://www.meneame.net/story/arresten-lideres-israel-crimenes-guerra;1715371648;1715379303;1;19;Kleshk;1715382613;Por menos se empezó una guerra en Irak hace 20 años...;0;0
https://www.meneame.net/story/arresten-lideres-israel-crimenes-guerra;1715371648;1715379303;1;20;Cherenkov;1715386692;#3 Es el sello de calidad bro, si pone el negativo probablemente saldrá a portada.;2;38
https://www.meneame.net/story/arresten-lideres-israel-crimenes-guerra;1715371648;1715379303;1;21;Polarin;1715394751;#4 Eso se llama limpieza etnica.;0;0
https://www.meneame.net/story/arresten-lideres-israel-crimenes-guerra;1715371648;1715379303;1;22;aozora;1715396362;Cuanto odio, ¿no?;0;0
https://www.meneame.net/story/arresten-lideres-israel-crimenes-guerra;1715371648;1715379303;1;23;moco36;1715409967;Una cancer no se arregla cambiándolo de sitio, erradicación de esta gentuza es lo que hay que hacer.;0;0
https://www.meneame.net/story/arresten-lideres-israel-crimenes-guerra;1715371648;1715379303;1;24;Txape;1715410117;#10 todo israelí que haya estado en el ejército debe de ser juzgado. Y mientras eso no pase, no permitir que puedan entrar en mi país esos criminales, por lo que dice #14. Por nuestra seguridad.;0;0
https://www.meneame.net/story/arresten-lideres-israel-crimenes-guerra;1715371648;1715379303;1;25;solojavi;1715410533;Siguiendo su política habría que bombardear el país hasta que entreguen a los responsables del genocidio. De momento me confirmaría con que el cagón al que llaman biden retirara su flota de las inmediaciones (se lo han puesto fácil con las declaraciones de los últimos días dando a entender que pueden defenderse solitos), pero claramente lo de que no usen sus armas para matar ha sido un acto desesperado para tratar de evitar la sangría de votantes.;0;0
https://www.meneame.net/story/arresten-lideres-israel-crimenes-guerra;1715371648;1715379303;1;26;Hamuchan;1715411043;Hamás haría exactamente lo mismo, es más uno de sus objetivos es erradicar Israel, no sé de por qué os sorprende que se odien tanto entre ellos, es lo que tienen sociedades basadas en religiones mierda, que mantienen el odio constante con sus vecinos por décadas, etc. No se le veía a ninguna parte muchas ganas de hacer paz.  Yo conocí musulmanes extremistas en una empresa que trabajé en Japón, de la gente más turbia que conocí en mi vida, mejor no digo que tipo de fotos se sentían orgullosos de enseñar.;1;13
https://www.meneame.net/story/arresten-lideres-israel-crimenes-guerra;1715371648;1715379303;1;27;ErJakerNROL35;1715414417;#24 lo mismo con los palestinos;0;0
https://www.meneame.net/story/arresten-lideres-israel-crimenes-guerra;1715371648;1715379303;1;28;ErJakerNROL35;1715414466;#22 mucho odio antisemita en MNM;0;0
https://www.meneame.net/story/arresten-lideres-israel-crimenes-guerra;1715371648;1715379303;1;29;ErJakerNROL35;1715414504;#23 reportado por incitacion al odio;0;0
https://www.meneame.net/story/arresten-lideres-israel-crimenes-guerra;1715371648;1715379303;1;30;frankiegth;1715419278;"#0. La captura de la foto dice entre lineas : ""Cuando sonreir en la foto ya no puede ocultar tus miserias.""";0;0
https://www.meneame.net/story/arresten-lideres-israel-crimenes-guerra;1715371648;1715379303;1;31;crioyo;1715420952;Igual que en la Alemania nazi, eso no basta. Hace falta una intervención y un reciclado institucional profundo. Ah, y un control internacional que asegure que se respetan los ddhh de los palestinos.  Por no hablar de sanciones ejemplares a los que han apoyado esta barbarie.  Quizás en una realidad paralela, la historia la escriben los vencedores…;0;0
https://www.meneame.net/story/pelotazo-curas-salesianos-pista-padel-provoca-indignacion;1715367709;1715377802;1;1;ElenaTripillas;1715367847;Que cosas pasan en tetuán   old.meneame.net/story/vecinos-tetuan-critican-actitud-irresponsable-pe;2;50
https://www.meneame.net/story/pelotazo-curas-salesianos-pista-padel-provoca-indignacion;1715367709;1715377802;1;2;DenisseJoel;1715367887;Poco a poco va saliendo a la luz lo que hay detrás del pádel.;1;15
https://www.meneame.net/story/pelotazo-curas-salesianos-pista-padel-provoca-indignacion;1715367709;1715377802;1;3;skout2;1715367909;"Y seguro que si emiten factura vendrá como ""donación"" para no pagar impuestos, como hacen en las entradas de las catedrales.";13;93
https://www.meneame.net/story/pelotazo-curas-salesianos-pista-padel-provoca-indignacion;1715367709;1715377802;1;4;woody_alien;1715368486;Que buenos son ...;0;0
https://www.meneame.net/story/pelotazo-curas-salesianos-pista-padel-provoca-indignacion;1715367709;1715377802;1;5;ochoceros;1715369586;Vaya afán de sacar dinero que tiene la iglesia. La religión católica en España cada vez queda más como un mal chiste ante este tipo de agravios a la gente para contentar a su verdadero dios: EL DINERO.;6;51
https://www.meneame.net/story/pelotazo-curas-salesianos-pista-padel-provoca-indignacion;1715367709;1715377802;1;6;laruladelnorte;1715370396;Ismael habla de “impunidad” mientras los curas salesianos continúan haciendo caja. “Se comportan con impunidad porque les sale a cuenta hasta la multa. Igual se llevan 2.500 euros al mes solo con lo recaudado los fines de semana”, relata.  Con la iglesia hemos topado...;4;41
https://www.meneame.net/story/pelotazo-curas-salesianos-pista-padel-provoca-indignacion;1715367709;1715377802;1;7;elmakina;1715370797;¡Vaya tiquismiquis tienen algunos vecinos! ¿Qué esperaban al vivir cerca de un colegio? El deporte es fundamental para la salud física y mental de las personas, ¡y ahora vienen con quejas por unas raquetas que suenan un poco! Los Salesianos tienen todo el derecho de sacar un beneficio de sus instalaciones, ¿acaso los vecinos no se benefician también de tener una escuela en el barrio? Deberían dejar de ser tan amargados y aprender a disfrutar de la vida. ¡Dejen que la gente juegue y dejen de molestar!;12;-30
https://www.meneame.net/story/pelotazo-curas-salesianos-pista-padel-provoca-indignacion;1715367709;1715377802;1;8;endy;1715371977;Titular estilo Matías Prats;0;0
https://www.meneame.net/story/pelotazo-curas-salesianos-pista-padel-provoca-indignacion;1715367709;1715377802;1;9;palasmemeces_63fb34f6d72;1715377930;Siendo salesianos que jodan pero no den por culo es un avance.;1;13
https://www.meneame.net/story/pelotazo-curas-salesianos-pista-padel-provoca-indignacion;1715367709;1715377802;1;10;Chaotic_and_Reckless_;1715378299;"Ningún juez de España va a atajar ningún desmán de la iglesia catolica. JAMÁS. En su mayoría son directamente siervos de alguna de las sectas de esta religión. y si no lo es, debe su puesto al partido que representa los intereses de la misma.   El dicho, ""con la iglesia hemos topado"" es fiel reflejo de que esto no es nuevo ni va a dejar de ocurrir.  Si esto lo hace un particular, y no es un pepero o un amiguete, que se de por jodido. Como lo hace la iglesia, a joderse toca a todos los afectados.";2;28
https://www.meneame.net/story/pelotazo-curas-salesianos-pista-padel-provoca-indignacion;1715367709;1715377802;1;11;diprosio;1715378533;#7 Tal vez haya que vivirlo para entenderlo.;6;44
https://www.meneame.net/story/pelotazo-curas-salesianos-pista-padel-provoca-indignacion;1715367709;1715377802;1;12;johel;1715378943;#5 ¿Cada vez mas? Por citar un ejemplo de hace 500 años... ¿Te has olvidado de por que surgieron los luteranos?;0;0
https://www.meneame.net/story/pelotazo-curas-salesianos-pista-padel-provoca-indignacion;1715367709;1715377802;1;13;xinxaxoxos;1715379034;¿Practican pádel 24 horas? En cualquier caso puede llamar a la policía, y sonómetro en mano, comprobar si se incumple la normativa de ruidos.  En caso de superar el límite legal tiene un buen motivo para denunciar y pedir una compensación pecuniaria que justifique esos 20,8 euros a la hora por reservar la pista.  www.madrid.es/portales/munimadrid/es/Inicio/Medio-ambiente/Cartas-de-s  El  ayuntamiento establece que el horario límite acaba a las 23 horas. en Valencia por ejemplo se espera silencio entre las 22 y las 08 horas en horario laboral.  Igual hay que mirar al ayuntamiento por esos horarios en vez del centro educativo reconvertido en espacio deportivo.;2;20
https://www.meneame.net/story/pelotazo-curas-salesianos-pista-padel-provoca-indignacion;1715367709;1715377802;1;14;ochoceros;1715379343;#12 Por lo de suma y sigue. Hacen 10.000 malas acciones por cada una buena.;0;0
https://www.meneame.net/story/pelotazo-curas-salesianos-pista-padel-provoca-indignacion;1715367709;1715377802;1;15;elmakina;1715379351;#11 yo vivo al lado de unas pistas y no es para tanto. Si te amargas por eso, ya no me imagino lo que te parecerá el ruido del tráfico, cuando el vecino tire de la cadena, o cualquier otra chorrada.;1;13
https://www.meneame.net/story/pelotazo-curas-salesianos-pista-padel-provoca-indignacion;1715367709;1715377802;1;16;xinxaxoxos;1715379500;¿Es un centro educativo o una instalación deportiva? Como tales deben estar dados de alta con un CNAE apropiado. Si es como colegio (el que he podido comprobar, no se si tiene alguno más) están con el epígrafe 8531, lo cual es adecuado como centro educativo de secundaria.;0;0
https://www.meneame.net/story/pelotazo-curas-salesianos-pista-padel-provoca-indignacion;1715367709;1715377802;1;17;xinxaxoxos;1715379539;#7 un colegio no acaba a las 23H;3;29
https://www.meneame.net/story/pelotazo-curas-salesianos-pista-padel-provoca-indignacion;1715367709;1715377802;1;18;elmakina;1715379614;#17 este sí, que también tiene instalaciones deportivas. Pero nada... prohibamos todo, que son curas y nos caen mal. Si fuese cualquier empresa privada los vecinos aplaudirían con las orejas.;4;0
https://www.meneame.net/story/pelotazo-curas-salesianos-pista-padel-provoca-indignacion;1715367709;1715377802;1;19;jamon_de_jaboogie;1715380040;#2 están los de equipo de investigación deseando que abras la veda para hacer un monográfico;2;17
https://www.meneame.net/story/pelotazo-curas-salesianos-pista-padel-provoca-indignacion;1715367709;1715377802;1;20;xinxaxoxos;1715380216;#18 Si pagan por la explotación de las pistas lo veo correcto. Hay que tener en cuenta que un centro educativo no es una instalación deportiva. Si se desmarca en ese aspecto debe hacer una sociedad para ese fin. Yo si vivese en esa zona sería el cabrón del laser.  www.eldiario.es/madrid/somos/tetuan/pistas-padel-alquila-colegio-relig www.elespanol.com/madrid/capital/20240508/guerra-tetuan-pistas-padel-c  Son noticiarios ladeados a la derecha, para hacernos una idea.;0;0
https://www.meneame.net/story/pelotazo-curas-salesianos-pista-padel-provoca-indignacion;1715367709;1715377802;1;21;BuddyHolly;1715380315;#5 El dinero, y también que dejen que los niños se les acerquen...;1;13
https://www.meneame.net/story/pelotazo-curas-salesianos-pista-padel-provoca-indignacion;1715367709;1715377802;1;22;elmakina;1715380386;#20 pero quien lloriquea es la izquierda de Más Madrid;3;-4
https://www.meneame.net/story/pelotazo-curas-salesianos-pista-padel-provoca-indignacion;1715367709;1715377802;1;23;xinxaxoxos;1715380575;#22 Los que lloriquean son los vecinos aledaños del colegio espacio deportivo.;4;34
https://www.meneame.net/story/pelotazo-curas-salesianos-pista-padel-provoca-indignacion;1715367709;1715377802;1;24;elmakina;1715380656;#23 algunos, que me da que son los más afines con este partido, conocido por su anticlericalismo, y que es el que se hace eco en el ayuntamiento.;1;-2
https://www.meneame.net/story/pelotazo-curas-salesianos-pista-padel-provoca-indignacion;1715367709;1715377802;1;25;xinxaxoxos;1715380944;#2 Pádel nuestro que estás en el cielo.;10;81
https://www.meneame.net/story/pelotazo-curas-salesianos-pista-padel-provoca-indignacion;1715367709;1715377802;1;26;elmakina;1715380969;"#10 ¡Menudo discurso conspiranoico y resentido! ¿En serio crees que todos los jueces son títeres de la iglesia católica? Qué falta de respeto hacia una institución fundamental en la administración de justicia en España. Los jueces son profesionales comprometidos con la imparcialidad y el Estado de derecho, y sugieres que están todos vendidos a los intereses de una religión. ¡Qué absurdo! Y sobre tu comentario de ""con la iglesia hemos topado"", ¿acaso crees que la iglesia católica tiene un poder omnipotente sobre la justicia? Es un comentario digno de una mente conspirativa y paranoica. La iglesia no es omnipotente, y si hay casos de abusos o desmanes, deben ser abordados con las leyes y procesos adecuados, como en cualquier otra institución. Deja de buscar chivos expiatorios.";1;17
https://www.meneame.net/story/pelotazo-curas-salesianos-pista-padel-provoca-indignacion;1715367709;1715377802;1;27;elmakina;1715381047;"#16 ¿Acaso no comprendes que un centro educativo puede incluir instalaciones deportivas como parte integral de su programa? La mentalidad estrecha y miope de algunos es verdaderamente lamentable. No necesitan estar ""dados de alta"" con un CNAE específico para poder ofrecer actividades deportivas. El hecho de que estén clasificados bajo el epígrafe 8531 es completamente adecuado, ¡deja de buscar problemas donde no los hay, que no te enteras!";0;0
https://www.meneame.net/story/pelotazo-curas-salesianos-pista-padel-provoca-indignacion;1715367709;1715377802;1;28;johel;1715381454;#14 las religiones son como las guerras, no cambian nunca.  Ahora hablamos de los nazis, pero  si prestas atencion al antiguo testamento, a la torá  o a cualquier libro religioso ahi indica que si no eres de la familia eres el enemigo y matar al enemigo es bueno.  Los genocidas religiosos ya estaban ahi antes y tarde o temprano nos hubiese tocado ser los exterminados.;1;14
https://www.meneame.net/story/pelotazo-curas-salesianos-pista-padel-provoca-indignacion;1715367709;1715377802;1;29;sofazen;1715381731;#15 Yo me imagino que tú no las oirás igual que ellos, porque mira que ha de joder tener el soniquete de la pelotita tantas horas. Y ya no digo si se celebran los puntos o si los saques incluyen el grito a lo Nadal.;0;0
https://www.meneame.net/story/pelotazo-curas-salesianos-pista-padel-provoca-indignacion;1715367709;1715377802;1;30;lavacaquellora;1715381775;#11 Hay quien no tiene un mínimo de empatía. Bueno, ni de dos dedos de frente. Pero vamos, por lo que veo el tema es que son de los suyos y claro, hay que defenderlos a capa y espada aunque necesite un calzador del tamaño de la luna.;1;18
https://www.meneame.net/story/pelotazo-curas-salesianos-pista-padel-provoca-indignacion;1715367709;1715377802;1;31;Grub;1715381814;#19 Abriendo la veda para un campo de tiro pocholo en la terraza con vistas al padel.;0;0
https://www.meneame.net/story/pelotazo-curas-salesianos-pista-padel-provoca-indignacion;1715367709;1715377802;1;32;osids;1715381958;"#5 Pero si es que sus fieles son así, hacen comuniones a los críos que ríete tú de las bodas de hace unos años, se gastan los padres más dinero en una comunión, que tú en alcohol desde los 15 hasta los 30, bautizan a los críos para hacer un fiesta porque la ultima vez que fueron a misa se murió alguien, no cumplen ni uno solo de sus mandamientos, y si les preguntases cualquier cosa de ""su religión"" no tendrían ni puta idea, eso sí métete tú con cualquier tradición absurda que lo más flojo que te han a decir es ""eso con los moros no te atreves"" o ""si tan rojo eres trabaja el día de la virgen"", póngase tono de mongolo en estas frases.  PD: Lo peor es que todavía me vienen familiares a decirme que porque no le hago esos paripes a mi hija o porque no la meto en un colegio religioso pa que no se junte con chusma, menudo asco le tengo";4;35
https://www.meneame.net/story/pelotazo-curas-salesianos-pista-padel-provoca-indignacion;1715367709;1715377802;1;33;Chaotic_and_Reckless_;1715381968;#26 Las pruebas son claras... Los únicos que conspiran, llevan sotana. Los únicos resentidos son los que ven con horror como la sociedad ha cambiado pero ellos no...  Tenemos la solución al alcance de la mano. Veremos si tenemos políticos valientes que se decidan a tomarla.  La justicia en España es fuerte con los débiles, y débil con los fuertes... Con la iglesia, los empresarios y las élites económicas y sus perros a sueldo hemos topado... ya podéis intentar esconder la verdad con medios de comunicación a sueldo y campañas de desinformación... Pero la sociedad tiene la verdad a la vista, solo tiene que querer verla.;2;25
https://www.meneame.net/story/pelotazo-curas-salesianos-pista-padel-provoca-indignacion;1715367709;1715377802;1;34;elmakina;1715381974;#29 yo creo que más bien hay gente que no puede soportar que haya gente disfrutando y pasándolo bien, o que los curas estén haciendo dinero, mientras ellos tienen que soportar su triste y amarga vida. Aunque también es cierto que a alguno le molesta el ruido de una mosca.;4;-23
https://www.meneame.net/story/pelotazo-curas-salesianos-pista-padel-provoca-indignacion;1715367709;1715377802;1;35;lavacaquellora;1715382112;#26 Los jueces son profesionales comprometidos con la imparcialidad y el Estado de derecho       Eso es tener gracia y no lo de elmundotoday;2;21
https://www.meneame.net/story/pelotazo-curas-salesianos-pista-padel-provoca-indignacion;1715367709;1715377802;1;36;elmakina;1715382120;#33 ¡Vaya perorata conspiranoica! Qué falta de perspectiva. La sociedad ha evolucionado, sí, pero no necesariamente en la dirección que tú crees. Culpar a la iglesia y a las élites económicas de todos los males es simplista y desinformado.  Las pruebas que mencionas, ¿dónde están? Solo veo una serie de afirmaciones sin respaldo real. ¿Tienes algún dato concreto que respalde tus acusaciones, o simplemente estás lanzando al aire tus resentimientos? Parece que estás más interesado en culpar a los demás que en buscar soluciones reales a los problemas.  Y sobre tu comentario de la justicia en España, ¿de dónde sacas esa conclusión tan categórica? La justicia puede tener sus fallos, como cualquier sistema humano, pero sugerir que está al servicio de unos pocos poderosos es una exageración absurda. Es hora de dejar de buscar chivos expiatorios y empezar a asumir la responsabilidad de nuestros propios destinos.;0;0
https://www.meneame.net/story/pelotazo-curas-salesianos-pista-padel-provoca-indignacion;1715367709;1715377802;1;37;manc0ntr0;1715382396;#24 ya te pueden pagar bien por el blanqueamiento que estás haciendo. Tu teclado debe echar humo ahora mismo, makina;1;14
https://www.meneame.net/story/pelotazo-curas-salesianos-pista-padel-provoca-indignacion;1715367709;1715377802;1;38;ochoceros;1715382671;#32 Pues con lo de este meneo desbloquean un nuevo logro porque han pasado de joder a los vecinos a la hora de tocar las campanas a joder a los vecinos desde primera hora hasta bastante después de la puesta del sol.  Es increíble la capacidad que tienen para sacar dinero. Con las inmatriculaciones y el alquiler de nichos en cementerios han hecho casi tanta pasta como con los alquileres de plazas de aparcamiento en parkings. Lo jodido es que además de no pagar apenas ningún impuesto siguen trincando dinero del estado como si fuesen pobres para cubrir casi cualquier posible gasto que tienen, desde gastos de personal, reparaciones y mantenimiento, hasta las emisoras de radio y TV que usan para hacer su adoctrinamiento.;1;18
https://www.meneame.net/story/pelotazo-curas-salesianos-pista-padel-provoca-indignacion;1715367709;1715377802;1;39;gershwin;1715384157;#19  'Pádel: el pelotazo' en Equipo de Investigación www.lasexta.com/temas/equipo_de_investigacion_padel-1;1;12
https://www.meneame.net/story/pelotazo-curas-salesianos-pista-padel-provoca-indignacion;1715367709;1715377802;1;40;xinxaxoxos;1715385508;#27 Un centro educativo puede y debe tener instalaciones deportivas. El CNAE es la Clasificación Nacionales de Actividades Económicas. Si cobran a particulares por las pistas deportivas del centro educativo es otra actividad económica distinta a la educativa. Yo comprendo y quiero entender, pero una sencilla inspección tributaria dará problemas al respecto. Para hacer bien las cosas me mandas un MP y puedo ofrecer asesoramiento.;1;10
https://www.meneame.net/story/pelotazo-curas-salesianos-pista-padel-provoca-indignacion;1715367709;1715377802;1;41;ptolomeus;1715388401;30 euros por 1h30 es super barato. Montar una pista de padel son minimo 25k y si luego añades iluminación etc no les queda mucho a los salesianos.;0;0
